{
  "requirementSummary": "DX Coil Height must update immediately after every edit, and must never update after an edit.",
  "hvacTerminology": [
    "DX Coil Height"
  ],
  "businessRules": [
    "DX Coil Height must update immediately after every edit.",
    "DX Coil Height must never update after an edit."
  ],
  "developerConsiderations": [],
  "ambiguities": [
    "The ticket contains contradictory requirements: one states DX Coil Height must update immediately after every edit, another states it must never update after an edit. It is unclear which behavior is intended or if there is a conditional context."
  ],
  "confidence": "LOW"
}