{
  "requirementSummary": "When a user selects Condenser Type \"AC\" (Air Cooled) or \"EC\" (Evaporative Cooled), the system displays the corresponding input fields, records the entered parameters, and, for AC condensers, provides specific options for Condenser Passes and Roof Type. The recorded AC/EC parameters together with per‑circuit cooling configurations are output as a configuration ready for ECS calculation.",
  "hvacTerminology": [
    "Condenser Type",
    "Air Cooled (AC)",
    "Evaporative Cooled (EC)",
    "Design Ambient",
    "ASHRAE Summer Design",
    "Condenser Passes",
    "AutoOdd",
    "AutoEven",
    "Roof Type",
    "dark roof",
    "light roof",
    "parapet",
    "shrouding",
    "Condenser Tube Material",
    "Condenser Fin Material",
    "Condenser Tube Size",
    "Condenser Fin Type",
    "Bank ID#",
    "EC Model",
    "Wet Bulb Temperature",
    "circuit‑level configuration",
    "ECS calculation"
  ],
  "businessRules": [
    "When the user selects the Condenser Type \"AC\" or \"EC\", the corresponding input fields shall be displayed.",
    "For an AC condenser, the Design Ambient field shall be a numeric input with default 95°F (or equivalent in °C) and its value shall be echoed in output 3.7.",
    "For an AC condenser, the ASHRAE Summer Design field shall be a numeric input with no default specified.",
    "For an AC condenser, the Default Condenser field shall be a user‑selectable checkbox.",
    "For an AC condenser, the High Amb. / Altit. Cond. field shall be a user‑selectable checkbox.",
    "For an AC condenser, the Condenser Tube Material field shall be a dropdown with default \"Copper\".",
    "For an AC condenser, the Condenser Fin Material field shall be a dropdown with default \"Aluminum\".",
    "For an AC condenser, the Condenser Tube Size field shall be a dropdown offering \"3/8\" and \"3/8 w/ 1\\\" spacing\" options (units mm).",
    "For an AC condenser, the Condenser Fin Type field shall be a dropdown with default \"Corrugated\".",
    "For an EC condenser, the Bank ID# field shall be an ID supplied by the system.",
    "For an EC condenser, the Copies of this Bank field shall be a numeric input.",
    "For an EC condenser, the EC Model field shall be a dropdown populated from the catalog.",
    "For an EC condenser, the Wet Bulb Temperature field shall be a numeric input (units °F/°C).",
    "Given the AC/EC condenser parameters and per‑circuit cooling configurations, when processed, the system shall output condenser and circuit‑level configuration ready for ECS calculation.",
    "When configuring an AC condenser and the user enters ambient design conditions and coil geometry, the system shall record the condenser parameters.",
    "When configuring an EC condenser and the user enters the EC model and wet bulb temperature, the system shall record the EC condenser parameters.",
    "When configuring an AC condenser and the user selects Condenser Passes, the system shall display options: AutoOdd, AutoEven, and the integers 2 through 41 inclusive, incrementing by 1.",
    "When configuring an AC condenser and the user selects Roof Type, the system shall display the specified dark and light roof type options, each with and without parapet/shrouding."
  ],
  "developerConsiderations": [
    "Implement conditional UI rendering to show AC‑specific fields when Condenser Type = AC and EC‑specific fields when Condenser Type = EC.",
    "Support numeric inputs with unit selection (°F/°C) and default values where specified.",
    "Provide dropdown components with the listed default selections and options.",
    "Implement checkbox components for Default Condenser and High Amb. / Altit. Cond. fields.",
    "Render Condenser Passes options list containing AutoOdd, AutoEven, and numbers 2‑41 inclusive.",
    "Render Roof Type options covering dark and light roof variants, each with optional parapet and shrouding selections.",
    "Record entered parameters for later ECS calculation output.",
    "Ensure the Design Ambient default of 95°F is pre‑populated in the UI."
  ],
  "ambiguities": [
    "The acceptable range or validation limits for numeric inputs such as Design Ambient, ASHRAE Summer Design, and Wet Bulb Temperature are not specified.",
    "The unit column for Condenser Tube Size lists mm, but the option values are expressed as fractions of an inch (e.g., \"3/8\"); the required unit conversion or representation is unclear.",
    "The exact list of dark and light roof type options, including how parapet and shrouding are presented, is not enumerated.",
    "The specific EC Model options to be shown in the dropdown are referenced as \"See Catalog\" but not listed.",
    "Details of the per‑circuit cooling configurations that feed into the ECS calculation are not provided.",
    "The meaning and source of \"output 3.7\" where Design Ambient is echoed is not defined.",
    "Whether AutoOdd and AutoEven are mutually exclusive with the numeric pass options, or can be selected together, is not clarified.",
    "The purpose and valid values for the \"Copies of this Bank\" numeric input are not described.",
    "How the system generates or retrieves the Bank ID# from the system is not explained."
  ],
  "confidence": "MEDIUM"
}